{
  "id": "ngautopilot-quality",
  "name": "NgAutoPilot Quality",
  "version": "0.11.0",
  "status": "stable",
  "description": "Quality and audit skills: ESLint, SonarQube, no-dead-code, technical debt triage, pull request review.",
  "audience": "Quality owners, leads, and reviewers",
  "useCases": [
    "Lint cleanup",
    "Dead code triage",
    "Review and consistency checks"
  ],
  "includes": {
    "skills": ["quality."],
    "agents": ["spartan-contrarian-developer", "roman-consolidator"],
    "prompts": [],
    "guardrails": []
  },
  "excludes": [],
  "dependsOn": ["ngautopilot-core"]
}
