{
  "id": "ngautopilot-angular-testing",
  "name": "NgAutoPilot Angular Testing",
  "version": "0.8.1",
  "status": "stable",
  "description": "Angular TestBed, component tests, visual validation, and upgrade test-stability guidance without full catalog installation.",
  "audience": "Angular developers improving test reliability and coverage",
  "useCases": ["Component testing", "Angular upgrade validation"],
  "includes": {
    "skills": ["angular.testing."],
    "agents": ["testing-hoplite"],
    "prompts": [],
    "guardrails": []
  },
  "excludes": [],
  "dependsOn": ["ngautopilot-core"]
}
