{
  "id": "ngautopilot-angular-ui",
  "name": "NgAutoPilot Angular UI",
  "version": "0.8.1",
  "status": "stable",
  "description": "Forms, router, templates, Material, and styles for Angular user-interface work in one bounded pack.",
  "audience": "Angular developers building forms, navigation, and component interfaces",
  "useCases": ["Reactive and Signal Forms", "Routing and template work"],
  "includes": {
    "skills": ["angular.forms.", "angular.router.", "angular.templates.", "angular.material.", "angular.styles."],
    "agents": [],
    "prompts": [],
    "guardrails": []
  },
  "excludes": [],
  "dependsOn": ["ngautopilot-core"]
}
