{
  "id": "ngautopilot-javascript",
  "name": "NgAutoPilot JavaScript",
  "version": "0.11.0",
  "status": "stable",
  "description": "JavaScript fundamentals, modules, async error handling, pure functions, ECMAScript compatibility.",
  "audience": "JavaScript developers",
  "useCases": [
    "Async pipeline hardening",
    "Module structure",
    "ECMAScript host compatibility gates"
  ],
  "includes": {
    "skills": ["javascript."],
    "agents": [],
    "prompts": [],
    "guardrails": []
  },
  "excludes": [],
  "dependsOn": ["ngautopilot-core"]
}