{
  "id": "ngautopilot-angular-foundations",
  "name": "NgAutoPilot Angular Foundations",
  "version": "0.11.0",
  "status": "stable",
  "description": "Angular architecture, components, dependency boundaries, and service design for a focused daily-development baseline.",
  "audience": "Angular teams starting a focused NgAutoPilot installation",
  "useCases": ["Angular application architecture", "Component and service design"],
  "includes": {
    "skills": ["angular.architecture.", "angular.components.", "angular.services."],
    "agents": ["athenian-angular-architect"],
    "prompts": [],
    "guardrails": []
  },
  "excludes": [],
  "dependsOn": ["ngautopilot-core"]
}
